{
  "$schema": "https://json-schema.org/draft/2020-12/schema",
  "title": "NCS group learning content",
  "type": "object",
  "required": ["group", "unit", "subtitle", "sections", "images", "sources", "worksheets", "files"],
  "properties": {
    "example": {"const": false},
    "group": {"enum": ["A", "B", "C"]},
    "unit": {"type": "string", "minLength": 1},
    "subtitle": {"type": "string", "minLength": 1},
    "sections": {"type": "array", "minItems": 1, "items": {"type": "object", "required": ["title", "html"], "properties": {"title": {"type": "string", "minLength": 1}, "html": {"type": "string", "minLength": 1}}}},
    "images": {"type": "array", "minItems": 1, "uniqueItems": true, "items": {"type": "string"}},
    "sources": {"type": "array", "minItems": 1, "items": {"type": "object", "required": ["url", "title", "provider", "language", "free", "scope", "activity", "checked_at"], "properties": {"url": {"type": "string", "format": "uri"}, "title": {"type": "string", "minLength": 1}, "provider": {"type": "string", "minLength": 1}, "language": {"const": "ko"}, "free": {"const": true}, "scope": {"type": "string", "minLength": 1}, "activity": {"type": "string", "minLength": 1}, "checked_at": {"type": "string", "format": "date-time"}}}},
    "worksheets": {"type": "array", "minItems": 1, "items": {"type": "object", "required": ["title", "fields"], "properties": {"title": {"type": "string", "minLength": 1}, "fields": {"type": "array", "minItems": 1, "items": {"type": "string", "minLength": 1}}}}},
    "files": {"type": "array", "minItems": 1, "uniqueItems": true, "items": {"type": "string"}}
  }
}
