{
  "example": false,
  "group": "C",
  "unit": "디자인 구성요소 설계",
  "subtitle": "한 화면의 필수 내용과 와이어프레임부터 정확히 맞추기",
  "sections": [
    {
      "title": "시작하기: 기존 파일과 요구사항 확인",
      "html": "<p>본인의 설계 방향 제안서, 화면 설계서, 와이어프레임을 엽니다. 파일이 없거나 그림의 글자를 읽기 어렵다면 그 상태를 먼저 기록하세요. 기존 파일을 다시 만들기 전에 브리프에서 필수 정보와 제외 조건을 표시합니다.</p><ul><li>실제 파일 이름과 열리는 위치를 기록한다.</li><li>필수 콘텐츠와 신청 경로를 목록으로 만든다.</li><li>현재 화면에서 읽히지 않거나 빠진 항목에 표시한다.</li></ul><blockquote><p>아래 가상 &#x27;주말 클래스 신청&#x27; 예시는 연습용입니다. 본인의 과제에 없는 콘텐츠를 필수로 추가하지 않습니다.</p></blockquote>"
    },
    {
      "title": "한 화면을 작은 부분으로 나눠 그리기",
      "html": "<p>대표 화면 한 개를 선택하고 머리글, 핵심 안내, 세부 정보, 신청 영역, 바닥글 순서로 상자를 그립니다. 상자마다 전달할 정보 한두 개와 버튼의 목적을 먼저 적고 색상과 장식은 나중에 정합니다.</p><table><tr><th>가상 화면 부분</th><th>확인할 내용</th></tr><tr><td>핵심 안내</td><td>무엇을 신청하는지 한 문장으로 보이는가</td></tr><tr><td>일정·장소</td><td>날짜와 장소가 실제 자료에서 확인된 정보인가</td></tr><tr><td>신청 영역</td><td>버튼을 누른 뒤 어디로 가는지 설명되는가</td></tr></table><p><img src=\"@@design-map.png@@\" alt=\"C그룹 가상 클래스 신청 화면의 필수 정보 목록과 한 화면 와이어프레임 연결 예시\" /></p><p>실습양식 01에 자신의 화면을 같은 방식으로 나눠 적습니다. 예시의 문구나 서비스 이름을 본인의 과제 답안으로 사용하지 마세요.</p>"
    },
    {
      "title": "설계서와 와이어프레임을 나란히 확인",
      "html": "<p>설계서의 각 섹션 제목 옆에 대응하는 와이어프레임의 위치를 적습니다. 한쪽에만 있는 정보, 다른 색상·문구·순서, 빠진 신청 영역을 표시하고 한 건씩 고칩니다.</p><table><tr><th>검사</th><th>통과 기준</th></tr><tr><td>내용</td><td>필수 문구와 정보가 두 파일에서 같은 뜻으로 보임</td></tr><tr><td>순서</td><td>단계 번호와 화면 순서가 일치함</td></tr><tr><td>판독</td><td>이미지로 내보낸 뒤에도 본문과 버튼 글자가 읽힘</td></tr></table><p>PNG 이미지가 흐리면 원본 프레임의 글자 크기와 내보내기 크기를 점검하고, 저장한 파일을 실제로 다시 열어 확인합니다.</p>"
    },
    {
      "title": "버튼 한 개의 사용성과 수정 기록",
      "html": "<p>대표 화면의 신청 버튼 하나를 고릅니다. 버튼의 기본 상태, 눌렀을 때의 결과, 입력이 잘못됐을 때의 안내를 간단한 화살표로 그립니다. Figma 프로토타입 기능을 쓰지 않아도 설계서에 흐름을 설명할 수 있습니다.</p><table><tr><th>기록 칸</th><th>가상 예시</th></tr><tr><td>요청 또는 제안</td><td>AI가 신청 버튼 문구를 &#x27;지금 시작&#x27;으로 제안</td></tr><tr><td>확인한 문제</td><td>무엇을 시작하는지 모호함</td></tr><tr><td>수정과 검수</td><td>&#x27;클래스 신청하기&#x27;로 수정하고 화면과 설계서 문구 대조</td></tr></table><p>실습양식 02에 자신의 실제 수정 한 건을 적고, 수정한 파일과 화면 위치를 기록합니다.</p>"
    },
    {
      "title": "완료 기준과 다음 학습",
      "html": "<ul><li>기존 파일을 모두 열어 실제 상태를 확인했다.</li><li>대표 화면 하나의 필수 내용과 신청 경로가 설계서·와이어프레임에서 일치한다.</li><li>글자와 단계 번호를 내보낸 파일에서도 읽을 수 있다.</li><li>수정한 한 건의 이유, 위치, 재확인 결과를 적었다.</li></ul><p>한 화면을 맞춘 뒤 같은 방법으로 나머지 화면을 점검합니다. 다음 관련 수업에서 고친 전후 화면과 남은 질문을 함께 확인합니다.</p>"
    }
  ],
  "sources": [
    {
      "provider": "Figma Learn",
      "title": "Figma Design의 프레임",
      "url": "https://help.figma.com/hc/ko/articles/360041539473-Figma-Design%EC%9D%98-%ED%94%84%EB%A0%88%EC%9E%84",
      "language": "ko",
      "free": true,
      "scope": "프레임 만들기와 화면 크기 사전 설정",
      "activity": "기존 프레임을 열어 한 화면의 구역을 나누기",
      "checked_at": "2026-10-26T15:34:41+09:00"
    },
    {
      "provider": "Figma Learn",
      "title": "프로토타입 연결",
      "url": "https://help.figma.com/hc/ko/articles/360040315773-%ED%94%84%EB%A1%9C%ED%86%A0%ED%83%80%EC%9E%85-%EC%97%B0%EA%B2%B0",
      "language": "ko",
      "free": true,
      "scope": "트리거·액션·목적지의 기본 설명",
      "activity": "신청 버튼 한 개를 누른 뒤의 이동 경로 적기",
      "checked_at": "2026-10-26T15:34:41+09:00"
    },
    {
      "provider": "한국정보접근성인증평가원",
      "title": "한국형 웹 콘텐츠 접근성 지침 2.2",
      "url": "https://www.wa.or.kr/board/view.asp?BoardID=0004&page=1&sn=22592",
      "language": "ko",
      "free": true,
      "scope": "자료실의 무료 PDF에서 텍스트 판독과 조작 관련 항목",
      "activity": "내보낸 화면의 글자와 버튼을 실제로 읽고 점검하기",
      "checked_at": "2026-10-26T15:34:41+09:00"
    }
  ],
  "worksheets": [
    {
      "title": "한 화면 필수 정보와 배치",
      "fields": [
        "실제 브리프의 필수 정보",
        "기존 파일과 페이지",
        "설계서 섹션",
        "와이어프레임 위치",
        "실제 파일명과 페이지 또는 프레임",
        "관찰한 내용과 근거",
        "선택하거나 수정한 이유",
        "수정한 위치와 결과",
        "검수 조건과 확인 결과",
        "남은 질문"
      ]
    },
    {
      "title": "불일치와 한 건의 수정",
      "fields": [
        "읽히지 않거나 빠진 항목",
        "버튼의 행동과 다음 화면",
        "수정 전후 차이",
        "실제 파일명과 페이지 또는 프레임",
        "관찰한 내용과 근거",
        "선택하거나 수정한 이유",
        "수정한 위치와 결과",
        "검수 조건과 확인 결과",
        "남은 질문"
      ]
    }
  ],
  "images": [
    "design-map.png"
  ],
  "files": [
    "학습자료.pdf",
    "실습양식.docx",
    "읽는순서.txt",
    "design-map.png",
    "빈칸양식/01_실습.csv",
    "빈칸양식/02_실습.csv"
  ]
}
